{
  "lesson_id": "sat-math-two-way-tables-hard",
  "exam_id": "sat",
  "exam_name": "SAT",
  "domain": "math",
  "section": "problem_solving_data",
  "skill": "two_way_tables",
  "title": "Two-Way Tables · Hard",
  "order": 59,
  "difficulty": "hard",
  "teaching_card": {
    "title": "Two-Way Tables (Hard)",
    "body": "A two-way table sorts data by two categories. Probabilities come from the right total: use a row or column total for that group, and the grand total for the whole sample.",
    "key_points": [
      "Find the correct row/column total.",
      "Probability = favorable ÷ appropriate total.",
      "Use the grand total for a whole-sample probability."
    ]
  },
  "question_ids": [
    "sat-math-two-way-tables-hard-q01",
    "sat-math-two-way-tables-hard-q02",
    "sat-math-two-way-tables-hard-q03",
    "sat-math-two-way-tables-hard-q04",
    "sat-math-two-way-tables-hard-q05",
    "sat-math-two-way-tables-hard-q06",
    "sat-math-two-way-tables-hard-q07",
    "sat-math-two-way-tables-hard-q08",
    "sat-math-two-way-tables-hard-q09",
    "sat-math-two-way-tables-hard-q10",
    "sat-math-two-way-tables-hard-q11",
    "sat-math-two-way-tables-hard-q12",
    "sat-math-two-way-tables-hard-q13",
    "sat-math-two-way-tables-hard-q14",
    "sat-math-two-way-tables-hard-q15",
    "sat-math-two-way-tables-hard-q16",
    "sat-math-two-way-tables-hard-q17",
    "sat-math-two-way-tables-hard-q18",
    "sat-math-two-way-tables-hard-q19",
    "sat-math-two-way-tables-hard-q20"
  ],
  "prerequisite_lesson_ids": [
    "sat-math-two-way-tables-medium"
  ],
  "unlock_xp": 0,
  "tags": [
    "math",
    "two_way_tables",
    "hard"
  ],
  "version": "1.0.0",
  "estimated_minutes": 28
}
