{
  "lesson_id": "sat-rw-inferences-1",
  "exam_id": "sat",
  "exam_name": "SAT",
  "domain": "reading_writing",
  "section": "information_and_ideas",
  "skill": "inferences",
  "title": "Inferences",
  "order": 1,
  "difficulty": "medium",
  "teaching_card": {
    "title": "Making Inferences",
    "body": "An inference is a conclusion the passage supports but does not state outright. Stay close to the text: the best answer is the one the evidence forces, not the one that merely sounds reasonable.",
    "key_points": [
      "Base inferences on stated evidence.",
      "Avoid going further than the text allows.",
      "Eliminate choices the passage contradicts."
    ]
  },
  "question_ids": [
    "sat-rw-inferences-1-q01",
    "sat-rw-inferences-1-q02",
    "sat-rw-inferences-1-q03",
    "sat-rw-inferences-1-q04",
    "sat-rw-inferences-1-q05",
    "sat-rw-inferences-1-q06",
    "sat-rw-inferences-1-q07",
    "sat-rw-inferences-1-q08",
    "sat-rw-inferences-1-q09",
    "sat-rw-inferences-1-q10",
    "sat-rw-inferences-1-q11",
    "sat-rw-inferences-1-q12",
    "sat-rw-inferences-1-q13",
    "sat-rw-inferences-1-q14",
    "sat-rw-inferences-1-q15",
    "sat-rw-inferences-1-q16"
  ],
  "prerequisite_lesson_ids": [
    "sat-rw-main-idea-1"
  ],
  "unlock_xp": 0,
  "tags": [
    "reading_writing",
    "inferences"
  ],
  "version": "1.0.0",
  "estimated_minutes": 19
}
