{
  "lesson_id": "sat-rw-sentence-boundaries-1",
  "exam_id": "sat",
  "exam_name": "SAT",
  "domain": "reading_writing",
  "section": "standard_english_conventions",
  "skill": "sentence_boundaries",
  "title": "Sentence Boundaries",
  "order": 6,
  "difficulty": "easy",
  "teaching_card": {
    "title": "Sentence Boundaries",
    "body": "An independent clause can stand alone as a sentence. Two independent clauses cannot be joined by a comma alone (a comma splice) or by nothing (a run-on). Use a period, a semicolon, or a comma plus a coordinating conjunction.",
    "key_points": [
      "A comma alone can't join two independent clauses.",
      "Use a period or semicolon between independent clauses.",
      "A comma + FANBOYS conjunction also works."
    ]
  },
  "question_ids": [
    "sat-rw-sentence-boundaries-1-q01",
    "sat-rw-sentence-boundaries-1-q02",
    "sat-rw-sentence-boundaries-1-q03",
    "sat-rw-sentence-boundaries-1-q04",
    "sat-rw-sentence-boundaries-1-q05",
    "sat-rw-sentence-boundaries-1-q06",
    "sat-rw-sentence-boundaries-1-q07",
    "sat-rw-sentence-boundaries-1-q08",
    "sat-rw-sentence-boundaries-1-q09",
    "sat-rw-sentence-boundaries-1-q10",
    "sat-rw-sentence-boundaries-1-q11",
    "sat-rw-sentence-boundaries-1-q12",
    "sat-rw-sentence-boundaries-1-q13",
    "sat-rw-sentence-boundaries-1-q14",
    "sat-rw-sentence-boundaries-1-q15",
    "sat-rw-sentence-boundaries-1-q16",
    "sat-rw-sentence-boundaries-1-q17",
    "sat-rw-sentence-boundaries-1-q18",
    "sat-rw-sentence-boundaries-1-q19",
    "sat-rw-sentence-boundaries-1-q20",
    "sat-rw-sentence-boundaries-1-q21",
    "sat-rw-sentence-boundaries-1-q22",
    "sat-rw-sentence-boundaries-1-q23",
    "sat-rw-sentence-boundaries-1-q24",
    "sat-rw-sentence-boundaries-1-q25"
  ],
  "prerequisite_lesson_ids": [
    "sat-rw-cross-text-connections-1"
  ],
  "unlock_xp": 0,
  "tags": [
    "reading_writing",
    "sentence_boundaries"
  ],
  "version": "1.0.0",
  "estimated_minutes": 19
}
