{
  "lesson_id": "sat-math-circles-1",
  "exam_id": "sat",
  "exam_name": "SAT",
  "domain": "math",
  "section": "geometry_trigonometry",
  "skill": "circles",
  "title": "Circles",
  "order": 22,
  "difficulty": "medium",
  "teaching_card": {
    "title": "Circles",
    "body": "For a circle of radius r: the circumference (distance around) is 2πr, and the area is πr². The diameter is twice the radius. Answers are often left 'in terms of π.'",
    "key_points": [
      "Circumference = 2πr.",
      "Area = πr².",
      "Diameter = 2r."
    ],
    "worked_example": "Radius 3: area = 9π, circumference = 6π."
  },
  "question_ids": [
    "sat-math-circles-1-q01",
    "sat-math-circles-1-q02",
    "sat-math-circles-1-q03",
    "sat-math-circles-1-q04",
    "sat-math-circles-1-q05",
    "sat-math-circles-1-q06",
    "sat-math-circles-1-q07",
    "sat-math-circles-1-q08",
    "sat-math-circles-1-q09",
    "sat-math-circles-1-q10",
    "sat-math-circles-1-q11",
    "sat-math-circles-1-q12",
    "sat-math-circles-1-q13",
    "sat-math-circles-1-q14",
    "sat-math-circles-1-q15",
    "sat-math-circles-1-q16",
    "sat-math-circles-1-q17",
    "sat-math-circles-1-q18",
    "sat-math-circles-1-q19",
    "sat-math-circles-1-q20"
  ],
  "prerequisite_lesson_ids": [
    "sat-math-area-volume-2"
  ],
  "unlock_xp": 0,
  "tags": [
    "math",
    "circles"
  ],
  "version": "1.0.0",
  "estimated_minutes": 23
}
