{
  "lesson_id": "sat-math-systems-of-equations-2",
  "exam_id": "sat",
  "exam_name": "SAT",
  "domain": "math",
  "section": "algebra",
  "skill": "systems_of_equations",
  "title": "Systems of Equations II",
  "order": 4,
  "difficulty": "hard",
  "teaching_card": {
    "title": "Systems of Equations (Level 2)",
    "body": "A system gives two equations with two unknowns. Use substitution (solve one equation for a variable and plug in) or elimination (add or subtract the equations to cancel a variable). The solution makes both equations true at once.",
    "key_points": [
      "Substitution: isolate one variable, then substitute.",
      "Elimination: combine equations to cancel a variable.",
      "A solution satisfies both equations simultaneously."
    ],
    "worked_example": "x+y=7 and x−y=1 → add: 2x=8 → x=4, y=3."
  },
  "question_ids": [
    "sat-math-systems-of-equations-2-q01",
    "sat-math-systems-of-equations-2-q02",
    "sat-math-systems-of-equations-2-q03",
    "sat-math-systems-of-equations-2-q04",
    "sat-math-systems-of-equations-2-q05",
    "sat-math-systems-of-equations-2-q06",
    "sat-math-systems-of-equations-2-q07",
    "sat-math-systems-of-equations-2-q08",
    "sat-math-systems-of-equations-2-q09",
    "sat-math-systems-of-equations-2-q10",
    "sat-math-systems-of-equations-2-q11",
    "sat-math-systems-of-equations-2-q12",
    "sat-math-systems-of-equations-2-q13",
    "sat-math-systems-of-equations-2-q14",
    "sat-math-systems-of-equations-2-q15",
    "sat-math-systems-of-equations-2-q16",
    "sat-math-systems-of-equations-2-q17",
    "sat-math-systems-of-equations-2-q18",
    "sat-math-systems-of-equations-2-q19",
    "sat-math-systems-of-equations-2-q20"
  ],
  "prerequisite_lesson_ids": [
    "sat-math-systems-of-equations-1"
  ],
  "unlock_xp": 0,
  "tags": [
    "math",
    "systems_of_equations"
  ],
  "version": "1.0.0",
  "estimated_minutes": 30
}
