{
  "lesson_id": "sat-math-linear-equations-1",
  "exam_id": "sat",
  "exam_name": "SAT",
  "domain": "math",
  "section": "algebra",
  "skill": "linear_equations",
  "title": "Linear Equations",
  "order": 0,
  "difficulty": "easy",
  "teaching_card": {
    "title": "Solving Linear Equations",
    "body": "A linear equation keeps the variable to the first power. To solve, undo what was done to the variable using inverse operations, keeping both sides balanced: add/subtract to move constants, then multiply/divide to isolate the variable.",
    "key_points": [
      "Do the same operation to both sides.",
      "Move constants first, then divide by the coefficient.",
      "Check by substituting your answer back in."
    ],
    "worked_example": "3x + 5 = 20 → 3x = 15 → x = 5."
  },
  "question_ids": [
    "sat-math-linear-equations-1-q01",
    "sat-math-linear-equations-1-q02",
    "sat-math-linear-equations-1-q03",
    "sat-math-linear-equations-1-q04",
    "sat-math-linear-equations-1-q05",
    "sat-math-linear-equations-1-q06",
    "sat-math-linear-equations-1-q07",
    "sat-math-linear-equations-1-q08",
    "sat-math-linear-equations-1-q09",
    "sat-math-linear-equations-1-q10",
    "sat-math-linear-equations-1-q11",
    "sat-math-linear-equations-1-q12",
    "sat-math-linear-equations-1-q13",
    "sat-math-linear-equations-1-q14",
    "sat-math-linear-equations-1-q15",
    "sat-math-linear-equations-1-q16",
    "sat-math-linear-equations-1-q17",
    "sat-math-linear-equations-1-q18",
    "sat-math-linear-equations-1-q19",
    "sat-math-linear-equations-1-q20"
  ],
  "prerequisite_lesson_ids": [],
  "unlock_xp": 0,
  "tags": [
    "math",
    "linear_equations"
  ],
  "version": "1.0.0",
  "estimated_minutes": 23
}
