{
  "lesson_id": "sat-rw-concision-hard",
  "exam_id": "sat",
  "exam_name": "SAT",
  "domain": "reading_writing",
  "section": "expression_of_ideas",
  "skill": "concision",
  "title": "Concision · Hard",
  "order": 113,
  "difficulty": "hard",
  "teaching_card": {
    "title": "Concision (Hard)",
    "body": "Good writing says it once. Eliminate redundancy (repeating the same idea in different words) and wordy filler. The best choice is usually the shortest one that keeps the full meaning and stays grammatical.",
    "key_points": [
      "Cut words that repeat an idea.",
      "Prefer the shortest clear, grammatical option.",
      "Don't delete meaning — only redundancy."
    ]
  },
  "question_ids": [
    "sat-rw-concision-hard-q01",
    "sat-rw-concision-hard-q02",
    "sat-rw-concision-hard-q03",
    "sat-rw-concision-hard-q04",
    "sat-rw-concision-hard-q05",
    "sat-rw-concision-hard-q06",
    "sat-rw-concision-hard-q07",
    "sat-rw-concision-hard-q08",
    "sat-rw-concision-hard-q09",
    "sat-rw-concision-hard-q10",
    "sat-rw-concision-hard-q11",
    "sat-rw-concision-hard-q12",
    "sat-rw-concision-hard-q13",
    "sat-rw-concision-hard-q14",
    "sat-rw-concision-hard-q15",
    "sat-rw-concision-hard-q16"
  ],
  "prerequisite_lesson_ids": [
    "sat-rw-concision-medium"
  ],
  "unlock_xp": 0,
  "tags": [
    "reading_writing",
    "concision",
    "hard"
  ],
  "version": "1.0.0",
  "estimated_minutes": 12
}
