{
  "lesson_id": "sat-rw-pronouns-2",
  "exam_id": "sat",
  "exam_name": "SAT",
  "domain": "reading_writing",
  "section": "standard_english_conventions",
  "skill": "pronouns",
  "title": "Pronouns II",
  "order": 18,
  "difficulty": "hard",
  "teaching_card": {
    "title": "Pronoun Case (Level 2)",
    "body": "Choose pronoun case by the pronoun's job. Subjects take I, he, she, they, who; objects take me, him, her, them, whom. In compounds, test the pronoun alone to hear the right case.",
    "key_points": [
      "Subjective case for subjects (I, who).",
      "Objective case for objects (me, whom).",
      "In compounds, drop the other name to check."
    ]
  },
  "question_ids": [
    "sat-rw-pronouns-2-q01",
    "sat-rw-pronouns-2-q02",
    "sat-rw-pronouns-2-q03",
    "sat-rw-pronouns-2-q04",
    "sat-rw-pronouns-2-q05",
    "sat-rw-pronouns-2-q06",
    "sat-rw-pronouns-2-q07",
    "sat-rw-pronouns-2-q08",
    "sat-rw-pronouns-2-q09",
    "sat-rw-pronouns-2-q10",
    "sat-rw-pronouns-2-q11",
    "sat-rw-pronouns-2-q12",
    "sat-rw-pronouns-2-q13",
    "sat-rw-pronouns-2-q14",
    "sat-rw-pronouns-2-q15",
    "sat-rw-pronouns-2-q16",
    "sat-rw-pronouns-2-q17",
    "sat-rw-pronouns-2-q18",
    "sat-rw-pronouns-2-q19",
    "sat-rw-pronouns-2-q20",
    "sat-rw-pronouns-2-q21",
    "sat-rw-pronouns-2-q22",
    "sat-rw-pronouns-2-q23",
    "sat-rw-pronouns-2-q24",
    "sat-rw-pronouns-2-q25"
  ],
  "prerequisite_lesson_ids": [
    "sat-rw-pronouns-1"
  ],
  "unlock_xp": 0,
  "tags": [
    "reading_writing",
    "pronouns"
  ],
  "version": "1.0.0",
  "estimated_minutes": 19
}
