{
  "lesson_id": "sat-rw-rhetorical-synthesis-hard",
  "exam_id": "sat",
  "exam_name": "SAT",
  "domain": "reading_writing",
  "section": "expression_of_ideas",
  "skill": "rhetorical_synthesis",
  "title": "Rhetorical Synthesis · Hard",
  "order": 116,
  "difficulty": "hard",
  "teaching_card": {
    "title": "Rhetorical Synthesis (Hard)",
    "body": "You're given notes and a specific goal (introduce, emphasize, compare). Pick the sentence that uses the relevant notes to accomplish that exact goal — not just any accurate sentence.",
    "key_points": [
      "Read the goal carefully before the choices.",
      "Choose the option that serves that goal.",
      "Accurate but off-goal choices are traps."
    ]
  },
  "question_ids": [
    "sat-rw-rhetorical-synthesis-hard-q01",
    "sat-rw-rhetorical-synthesis-hard-q02",
    "sat-rw-rhetorical-synthesis-hard-q03",
    "sat-rw-rhetorical-synthesis-hard-q04",
    "sat-rw-rhetorical-synthesis-hard-q05",
    "sat-rw-rhetorical-synthesis-hard-q06",
    "sat-rw-rhetorical-synthesis-hard-q07",
    "sat-rw-rhetorical-synthesis-hard-q08",
    "sat-rw-rhetorical-synthesis-hard-q09",
    "sat-rw-rhetorical-synthesis-hard-q10",
    "sat-rw-rhetorical-synthesis-hard-q11"
  ],
  "prerequisite_lesson_ids": [
    "sat-rw-rhetorical-synthesis-medium"
  ],
  "unlock_xp": 0,
  "tags": [
    "reading_writing",
    "rhetorical_synthesis",
    "hard"
  ],
  "version": "1.0.0",
  "estimated_minutes": 13
}
