{
  "lesson_id": "sat-math-polynomials-1",
  "exam_id": "sat",
  "exam_name": "SAT",
  "domain": "math",
  "section": "advanced_math",
  "skill": "polynomials",
  "title": "Polynomials",
  "order": 11,
  "difficulty": "medium",
  "teaching_card": {
    "title": "Polynomial Expressions",
    "body": "To multiply two binomials, use FOIL: First, Outer, Inner, Last, then combine like terms. The coefficient of x comes from the Outer and Inner products added together.",
    "key_points": [
      "FOIL: First, Outer, Inner, Last.",
      "Combine like terms after multiplying.",
      "The x² term comes from First; the constant from Last."
    ],
    "worked_example": "(x+2)(x+3)=x²+5x+6."
  },
  "question_ids": [
    "sat-math-polynomials-1-q01",
    "sat-math-polynomials-1-q02",
    "sat-math-polynomials-1-q03",
    "sat-math-polynomials-1-q04",
    "sat-math-polynomials-1-q05",
    "sat-math-polynomials-1-q06",
    "sat-math-polynomials-1-q07",
    "sat-math-polynomials-1-q08",
    "sat-math-polynomials-1-q09",
    "sat-math-polynomials-1-q10",
    "sat-math-polynomials-1-q11",
    "sat-math-polynomials-1-q12",
    "sat-math-polynomials-1-q13",
    "sat-math-polynomials-1-q14",
    "sat-math-polynomials-1-q15",
    "sat-math-polynomials-1-q16",
    "sat-math-polynomials-1-q17",
    "sat-math-polynomials-1-q18",
    "sat-math-polynomials-1-q19",
    "sat-math-polynomials-1-q20"
  ],
  "prerequisite_lesson_ids": [
    "sat-math-exponents-radicals-2"
  ],
  "unlock_xp": 0,
  "tags": [
    "math",
    "polynomials"
  ],
  "version": "1.0.0",
  "estimated_minutes": 27
}
