{
  "lesson_id": "sat-rw-subject-verb-agreement-1",
  "exam_id": "sat",
  "exam_name": "SAT",
  "domain": "reading_writing",
  "section": "standard_english_conventions",
  "skill": "subject_verb_agreement",
  "title": "Subject-Verb Agreement",
  "order": 10,
  "difficulty": "easy",
  "teaching_card": {
    "title": "Subject-Verb Agreement",
    "body": "A verb must match its subject in number. Ignore words between the subject and verb — especially prepositional phrases — which often hide the true subject and bait you into the wrong number.",
    "key_points": [
      "Find the true subject, ignoring in-between phrases.",
      "Singular subject → singular verb; plural → plural.",
      "Watch indefinite pronouns like 'each' (singular)."
    ]
  },
  "question_ids": [
    "sat-rw-subject-verb-agreement-1-q01",
    "sat-rw-subject-verb-agreement-1-q02",
    "sat-rw-subject-verb-agreement-1-q03",
    "sat-rw-subject-verb-agreement-1-q04",
    "sat-rw-subject-verb-agreement-1-q05",
    "sat-rw-subject-verb-agreement-1-q06",
    "sat-rw-subject-verb-agreement-1-q07",
    "sat-rw-subject-verb-agreement-1-q08",
    "sat-rw-subject-verb-agreement-1-q09",
    "sat-rw-subject-verb-agreement-1-q10",
    "sat-rw-subject-verb-agreement-1-q11",
    "sat-rw-subject-verb-agreement-1-q12",
    "sat-rw-subject-verb-agreement-1-q13",
    "sat-rw-subject-verb-agreement-1-q14",
    "sat-rw-subject-verb-agreement-1-q15",
    "sat-rw-subject-verb-agreement-1-q16",
    "sat-rw-subject-verb-agreement-1-q17",
    "sat-rw-subject-verb-agreement-1-q18",
    "sat-rw-subject-verb-agreement-1-q19",
    "sat-rw-subject-verb-agreement-1-q20",
    "sat-rw-subject-verb-agreement-1-q21",
    "sat-rw-subject-verb-agreement-1-q22",
    "sat-rw-subject-verb-agreement-1-q23",
    "sat-rw-subject-verb-agreement-1-q24",
    "sat-rw-subject-verb-agreement-1-q25"
  ],
  "prerequisite_lesson_ids": [
    "sat-rw-sentence-boundaries-4"
  ],
  "unlock_xp": 0,
  "tags": [
    "reading_writing",
    "subject_verb_agreement"
  ],
  "version": "1.0.0",
  "estimated_minutes": 19
}
