{
  "lesson_id": "sat-rw-punctuation-2",
  "exam_id": "sat",
  "exam_name": "SAT",
  "domain": "reading_writing",
  "section": "standard_english_conventions",
  "skill": "punctuation",
  "title": "Punctuation & Possessives II",
  "order": 15,
  "difficulty": "medium",
  "teaching_card": {
    "title": "Punctuation and Possessives (Level 2)",
    "body": "Possession is shown with an apostrophe: add 's to a singular noun, and just an apostrophe after a plural noun ending in -s. A plain -s makes a plural, not a possessive.",
    "key_points": [
      "Singular possessive: add 's.",
      "Plural ending in -s: add only an apostrophe.",
      "No apostrophe makes a noun plural, not possessive."
    ]
  },
  "question_ids": [
    "sat-rw-punctuation-2-q01",
    "sat-rw-punctuation-2-q02",
    "sat-rw-punctuation-2-q03",
    "sat-rw-punctuation-2-q04",
    "sat-rw-punctuation-2-q05",
    "sat-rw-punctuation-2-q06",
    "sat-rw-punctuation-2-q07",
    "sat-rw-punctuation-2-q08",
    "sat-rw-punctuation-2-q09",
    "sat-rw-punctuation-2-q10",
    "sat-rw-punctuation-2-q11",
    "sat-rw-punctuation-2-q12",
    "sat-rw-punctuation-2-q13",
    "sat-rw-punctuation-2-q14",
    "sat-rw-punctuation-2-q15",
    "sat-rw-punctuation-2-q16",
    "sat-rw-punctuation-2-q17",
    "sat-rw-punctuation-2-q18",
    "sat-rw-punctuation-2-q19",
    "sat-rw-punctuation-2-q20",
    "sat-rw-punctuation-2-q21",
    "sat-rw-punctuation-2-q22",
    "sat-rw-punctuation-2-q23",
    "sat-rw-punctuation-2-q24",
    "sat-rw-punctuation-2-q25"
  ],
  "prerequisite_lesson_ids": [
    "sat-rw-punctuation-1"
  ],
  "unlock_xp": 0,
  "tags": [
    "reading_writing",
    "punctuation"
  ],
  "version": "1.0.0",
  "estimated_minutes": 19
}
