{
  "lesson_id": "sat-math-two-way-tables-medium",
  "exam_id": "sat",
  "exam_name": "SAT",
  "domain": "math",
  "section": "problem_solving_data",
  "skill": "two_way_tables",
  "title": "Two-Way Tables · Medium",
  "order": 58,
  "difficulty": "medium",
  "teaching_card": {
    "title": "Two-Way Tables (Medium)",
    "body": "A two-way table sorts data by two categories. Probabilities come from the right total: use a row or column total for that group, and the grand total for the whole sample.",
    "key_points": [
      "Find the correct row/column total.",
      "Probability = favorable ÷ appropriate total.",
      "Use the grand total for a whole-sample probability."
    ]
  },
  "question_ids": [
    "sat-math-two-way-tables-medium-q01",
    "sat-math-two-way-tables-medium-q02",
    "sat-math-two-way-tables-medium-q03",
    "sat-math-two-way-tables-medium-q04",
    "sat-math-two-way-tables-medium-q05",
    "sat-math-two-way-tables-medium-q06",
    "sat-math-two-way-tables-medium-q07",
    "sat-math-two-way-tables-medium-q08",
    "sat-math-two-way-tables-medium-q09",
    "sat-math-two-way-tables-medium-q10",
    "sat-math-two-way-tables-medium-q11",
    "sat-math-two-way-tables-medium-q12",
    "sat-math-two-way-tables-medium-q13",
    "sat-math-two-way-tables-medium-q14",
    "sat-math-two-way-tables-medium-q15",
    "sat-math-two-way-tables-medium-q16",
    "sat-math-two-way-tables-medium-q17",
    "sat-math-two-way-tables-medium-q18",
    "sat-math-two-way-tables-medium-q19",
    "sat-math-two-way-tables-medium-q20"
  ],
  "prerequisite_lesson_ids": [
    "sat-math-two-way-tables-easy"
  ],
  "unlock_xp": 0,
  "tags": [
    "math",
    "two_way_tables",
    "medium"
  ],
  "version": "1.0.0",
  "estimated_minutes": 28
}
