{
  "lesson_id": "sat-math-proportions-1",
  "exam_id": "sat",
  "exam_name": "SAT",
  "domain": "math",
  "section": "problem_solving_data",
  "skill": "proportions",
  "title": "Proportions & Rates",
  "order": 14,
  "difficulty": "easy",
  "teaching_card": {
    "title": "Proportions and Rates",
    "body": "A proportion sets two ratios equal. Cross-multiply to solve for an unknown. Rates compare two quantities with different units, like miles per hour; scale them up or down proportionally.",
    "key_points": [
      "Set equal ratios: a/b = c/d.",
      "Cross-multiply to solve: a·d = b·c.",
      "Keep units consistent on each side."
    ],
    "worked_example": "3/4 = x/12 → x = 9."
  },
  "question_ids": [
    "sat-math-proportions-1-q01",
    "sat-math-proportions-1-q02",
    "sat-math-proportions-1-q03",
    "sat-math-proportions-1-q04",
    "sat-math-proportions-1-q05",
    "sat-math-proportions-1-q06",
    "sat-math-proportions-1-q07",
    "sat-math-proportions-1-q08",
    "sat-math-proportions-1-q09",
    "sat-math-proportions-1-q10",
    "sat-math-proportions-1-q11",
    "sat-math-proportions-1-q12",
    "sat-math-proportions-1-q13",
    "sat-math-proportions-1-q14",
    "sat-math-proportions-1-q15",
    "sat-math-proportions-1-q16",
    "sat-math-proportions-1-q17",
    "sat-math-proportions-1-q18",
    "sat-math-proportions-1-q19",
    "sat-math-proportions-1-q20"
  ],
  "prerequisite_lesson_ids": [
    "sat-math-ratios-percentages-units-2"
  ],
  "unlock_xp": 0,
  "tags": [
    "math",
    "proportions"
  ],
  "version": "1.0.0",
  "estimated_minutes": 27
}
