{
  "lesson_id": "sat-math-area-volume-2",
  "exam_id": "sat",
  "exam_name": "SAT",
  "domain": "math",
  "section": "geometry_trigonometry",
  "skill": "area_volume",
  "title": "Area & Volume II",
  "order": 21,
  "difficulty": "hard",
  "teaching_card": {
    "title": "Area and Volume (Level 2)",
    "body": "Area measures a flat region; volume measures space inside a solid. Rectangle area = base × height; triangle area = ½ × base × height; box volume = length × width × height.",
    "key_points": [
      "Rectangle area = b·h.",
      "Triangle area = ½·b·h.",
      "Box volume = l·w·h."
    ],
    "worked_example": "A 4×5 rectangle has area 20."
  },
  "question_ids": [
    "sat-math-area-volume-2-q01",
    "sat-math-area-volume-2-q02",
    "sat-math-area-volume-2-q03",
    "sat-math-area-volume-2-q04",
    "sat-math-area-volume-2-q05",
    "sat-math-area-volume-2-q06",
    "sat-math-area-volume-2-q07",
    "sat-math-area-volume-2-q08",
    "sat-math-area-volume-2-q09",
    "sat-math-area-volume-2-q10",
    "sat-math-area-volume-2-q11",
    "sat-math-area-volume-2-q12",
    "sat-math-area-volume-2-q13",
    "sat-math-area-volume-2-q14",
    "sat-math-area-volume-2-q15",
    "sat-math-area-volume-2-q16",
    "sat-math-area-volume-2-q17",
    "sat-math-area-volume-2-q18",
    "sat-math-area-volume-2-q19",
    "sat-math-area-volume-2-q20"
  ],
  "prerequisite_lesson_ids": [
    "sat-math-area-volume-1"
  ],
  "unlock_xp": 0,
  "tags": [
    "math",
    "area_volume"
  ],
  "version": "1.0.0",
  "estimated_minutes": 25
}
